LdMxpz,25-34 years old,2,"At the office, At home, On the go",True,True,True,False,False,Other,False,False,False,False,False,False,False,False,False,True,Clever,"National chain (e.g. Starbucks, Dunkin), Specialty coffee shop",True,False,False,True,False,False,,Americano,,No - just black,True,False,False,False,False,,,,,,,,,,,,,,,,,,,,,,,,,,,,,Fruity,Very strong,Light,Full caffeine,6.0,3.0,4.0,4.0,"Citrus flavors, heavy lemon water feel",4.0,1.0,4.0,"Nutty, chocolate",2.0,2.0,3.0,"Milder, rounder nutty flavor coconut",1.0,5.0,3.0,"Red berries, Christmas, bright fruit notes, wine",Coffee B,Coffee A,Coffee B,I do a mix of both,$60-$80,"It tastes good, I need the caffeine, I need the ritual",True,True,True,False,False,,Yes,No,$10-$15,$10-$15,Yes,$100-$300,No,Male,,Some college or associate's degree,White/Caucasian,,Employed full-time,,Democrat
xd0kZv,35-44 years old,2,"At a cafe, At home",True,False,False,True,False,"Coffee brewing machine (e.g. Mr. Coffee), Pod/capsule machine (e.g. Keurig/Nespresso), Espresso, Cold brew",False,False,True,True,True,False,False,True,False,False,,,,,,,,,,Latte,,"Milk, dairy alternative, or coffee creamer, Flavor syrup, Sugar or sweetener",False,True,True,True,False,,Skim milk,False,True,False,False,False,False,False,False,False,"Artificial Sweeteners (e.g., Splenda)",False,True,False,False,False,False,False,False,,,,,,,,,Caramalized,Somewhat strong,Medium,Full caffeine,4.0,2.0,3.0,5.0,Dark chocolate and tangy cranberry,2.0,4.0,3.0,Apple and nut,4.0,2.0,2.0,Banana bread (no nuts) and cereal squares,4.0,4.0,4.0,Cider and a harvest festival feel,Coffee A,Coffee A,Coffee A,I primarily work in person,$80-$100,"It tastes good, I need the caffeine, Other",True,True,False,False,True,It soothes my arthritis,Yes,No,$10-$15,$10-$15,Yes,$50-$100,Yes,Non-binary,,High school graduate,White/Caucasian,,Employed full-time,,Democrat
RzZdlK,45-54 years old,2,At home,True,False,False,False,False,Pour over,True,False,False,False,False,False,False,False,False,False,,,,,,,,,,Pourover,,No - just black,True,False,False,False,False,,,,,,,,,,,,,,,,,,,,,,,,,,,,,Fruity,Medium,Light,Full caffeine,7.0,1.0,4.0,3.0,"light syrup mouthfeel, pear, concord grape, sweet",4.0,3.0,2.0,"very bitter at start, but settled in when lukewarm, dates, nuts, caramel, complex toasted rollercoaster but muted",4.0,2.0,2.0,"caramel, bitter at first taste when hot, mellowed out when cooled",2.0,4.0,5.0,"Fruity with blueberry notes, smooth silky mouthfeel with a lingering sweet finish (likely anaerobic fermented flavor enhancing the burst of flavor) ",Coffee A,Coffee D,Coffee D,I primarily work from home,$60-$80,It tastes good,True,False,False,False,False,,Yes,Yes,$8-$10,More than $20,Yes,$500-$1000,Yes,Male,,Bachelor's degree,White/Caucasian,,,,
pLPNQJ,35-44 years old,1,"At home, On the go",True,False,True,False,False,Pour over,True,False,False,False,False,False,False,False,False,False,,Local cafe,False,True,False,False,False,False,,Pourover,,No - just black,True,False,False,False,False,,,,,,,,,,,,,,,,,,,,,,,,,,,,,Chocolatey,Somewhat strong,Medium,Full caffeine,7.0,4.0,4.0,5.0,Caramel,4.0,2.0,4.0,,2.0,2.0,3.0,Mild,4.0,5.0,1.0,Sour,Coffee A,Coffee A,Coffee A,I do a mix of both,$40-$60,"I need the ritual, I need the caffeine, It makes me go to the bathroom, It tastes good",True,True,True,True,False,,Yes,Yes,$6-$8,$6-$8,No,$300-$500,Yes,Female,,Doctorate or professional degree,Asian/Pacific Islander,,Employed full-time,2,No affiliation
oAVjyx,35-44 years old,2,"At home, At the office",True,True,False,False,False,Pour over,True,False,False,False,False,False,False,False,False,False,,,,,,,,,,Pourover,,No - just black,True,False,False,False,False,,,,,,,,,,,,,,,,,,,,,,,,,,,,,Bright,Somewhat strong,Light,Full caffeine,5.0,2.0,3.0,4.0,Bright,2.0,2.0,4.0,"Well balanced, full bodied",3.0,2.0,3.0,"Similar to B, thinner mouth feel",3.0,4.0,3.0,"Nutty, earthy, fruity",Coffee B,Coffee A,Coffee B,I primarily work from home,$20-$40,"It tastes good, I need the ritual",True,False,True,False,False,,Yes,Yes,$4-$6,$6-$8,No,$50-$100,Yes,Male,,Master's degree,White/Caucasian,,Employed full-time,,Democrat
dY2JDV,25-34 years old,4,"At home, At a cafe, At the office",True,True,False,True,False,"Pour over, Coffee brewing machine (e.g. Mr. Coffee), Pod/capsule machine (e.g. Keurig/Nespresso), Instant coffee",True,False,False,True,True,True,False,False,False,False,,,,,,,,,,Americano,,No - just black,True,False,False,False,False,,,,,,,,,,,,,,,,,,,,,,,,,,,,,Floral,Somewhat light,Light,Full caffeine,4.0,2.0,4.0,4.0,"Peach, pancakes",3.0,3.0,2.0,Rye,3.0,2.0,1.0,Cookies,3.0,4.0,5.0,"Toffee, breakfast cereal",Coffee A,Coffee D,Coffee D,I primarily work from home,>$100,"It tastes good, I need the caffeine",True,True,False,False,False,,Yes,Yes,$4-$6,$4-$6,No,$500-$1000,Yes,Male,,Doctorate or professional degree,Hispanic/Latino,,Employed full-time,,No affiliation
g5N6BN,18-24 years old,Less than 1,At a cafe,False,False,False,True,False,,,,,,,,,,,,,,,,,,,,,Iced coffee,,Sugar or sweetener,False,False,True,False,False,,,,,,,,,,,,Granulated Sugar,True,False,False,False,False,False,False,False,,,,,,,,,Full Bodied,Medium,Light,Decaf,2.0,1.0,1.0,4.0,Sweeter. Flowery,3.0,4.0,5.0,"Dirt? Liked at beginning and end, not the middle. Very nice aroma",4.0,2.0,3.0,Milk chocolate,4.0,3.0,3.0,Tart,Coffee B,Coffee A,Coffee B,I primarily work from home,<$20,It tastes good,True,False,False,False,False,,Yes,No,$6-$8,$8-$10,Yes,Less than $20,Yes,Male,,Bachelor's degree,White/Caucasian,,Employed full-time,,Democrat
PABJvP,25-34 years old,2,At home,True,False,False,False,False,"Espresso, French press",False,True,True,False,False,False,False,False,False,False,,,,,,,,,,Espresso,,"No - just black, Milk, dairy alternative, or coffee creamer",True,True,False,False,False,,Oat milk,False,False,False,False,False,True,False,False,False,,,,,,,,,,,,,,,,,,Fruity,Very strong,Light,Full caffeine,8.0,2.0,4.0,3.0,,4.0,3.0,2.0,,4.0,2.0,4.0,,1.0,5.0,5.0,,Coffee C,Coffee D,Coffee D,I primarily work from home,$20-$40,"It tastes good, I need the caffeine, I need the ritual, It makes me go to the bathroom",True,True,True,True,False,,Yes,Yes,$4-$6,$2-$4,No,$500-$1000,Yes,Male,,Master's degree,White/Caucasian,,Employed full-time,,Democrat
ZdGML5,25-34 years old,2,"At the office, At home, At a cafe",True,True,False,True,False,"Pod/capsule machine (e.g. Keurig/Nespresso), Pour over",True,False,False,False,True,False,False,False,False,False,,,,,,,,,,Pourover,,No - just black,True,False,False,False,False,,,,,,,,,,,,,,,,,,,,,,,,,,,,,Chocolatey,Somewhat strong,Medium,Full caffeine,6.0,2.0,3.0,3.0,Caramel,3.0,2.0,5.0,Chocolatey,4.0,2.0,4.0,"Woody, smokey",4.0,3.0,2.0,Berry,Coffee B,Coffee A,Coffee B,I do a mix of both,$60-$80,"I need the ritual, It tastes good",True,False,True,False,False,,Yes,No,$10-$15,$10-$15,No,$300-$500,Yes,Female,,Bachelor's degree,Hispanic/Latino,,Employed full-time,,Democrat
GrodaO,35-44 years old,2,At home,True,False,False,False,False,"Pour over, Espresso",True,False,True,False,False,False,False,False,False,False,,,,,,,,,,Regular drip coffee,,No - just black,True,False,False,False,False,,,,,,,,,,,,,,,,,,,,,,,,,,,,,Fruity,Medium,Light,Full caffeine,7.0,2.0,4.0,4.0,"Caramel, changes big time when cool. Preference changed wildly",3.0,3.0,2.0,"Christmas morning, warm, robust",4.0,2.0,3.0,"Drying of the mouth, roasty, diner coffee, Hawaii. Huge dislike to like",2.0,3.0,4.0,"Natural process,",Coffee C,Coffee D,Coffee D,I primarily work from home,$40-$60,"It tastes good, I need the ritual, I need the caffeine",True,True,True,False,False,,Yes,Yes,$4-$6,$4-$6,Yes,"More than $1,000",Yes,Male,,,,,,,
1r2Q0M,45-54 years old,2,At home,True,False,False,False,False,"Pour over, French press, Other",True,True,False,False,False,False,False,False,False,True,Aeropress ,,,,,,,,,Latte,,No - just black,True,False,False,False,False,,,,,,,,,,,,,,,,,,,,,,,,,,,,,Bright,Medium,Medium,Full caffeine,3.0,2.0,4.0,3.0,"Mild caramel
Earthy
Savory",3.0,2.0,3.0,Mild neutral coffee flavor,3.0,3.0,2.0,Mild,2.0,2.0,5.0,"Berry scent
Grassy taste",Coffee B,Coffee D,Coffee D,I primarily work from home,$40-$60,"It tastes good, It makes me go to the bathroom, I need the caffeine",True,True,False,True,False,,Yes,Yes,$10-$15,$6-$8,Yes,$500-$1000,Yes,Male,,Bachelor's degree,White/Caucasian,,Employed full-time,,Democrat
oAVjDN,35-44 years old,4,"At home, At the office",True,True,False,False,False,"Pod/capsule machine (e.g. Keurig/Nespresso), Pour over",True,False,False,False,True,False,False,False,False,False,,,,,,,,,,Pourover,,"Milk, dairy alternative, or coffee creamer",False,True,False,False,False,,Whole milk,True,False,False,False,False,False,False,False,False,,,,,,,,,,,,,,,,,,Chocolatey,Somewhat strong,Medium,Full caffeine,7.0,3.0,4.0,2.0,"Hints of cherries, very acidic
",2.0,1.0,4.0,"Darker roast, presence of chocolate. And vanilla. 
Great as an everyday coffee.",4.0,1.0,3.0,"Black roast, hints of fruits. Lacking the chocolate and vanilla I normally expect.",2.0,3.0,4.0,Hints of acidity without pepper and cherry without sourness.,Coffee B,Coffee D,Coffee B,I primarily work from home,>$100,"I need the caffeine, It tastes good",True,True,False,False,False,,Yes,Yes,$8-$10,$10-$15,No,$100-$300,Yes,Male,,Bachelor's degree,White/Caucasian,,Employed full-time,,No affiliation
ZdRMve,25-34 years old,1,"At home, At a cafe",True,False,False,True,False,Cold brew,False,False,False,False,False,False,False,True,False,False,,,,,,,,,,Iced coffee,,"Milk, dairy alternative, or coffee creamer",False,True,False,False,False,,"Flavored coffee creamer, Oat milk",False,False,False,False,True,True,False,False,False,,,,,,,,,,,,,,,,,,Sweet,Medium,Light,Full caffeine,5.0,1.0,4.0,4.0,Cranberry,4.0,1.0,1.0,Cocoa,3.0,2.0,2.0,"Hay, brandy",2.0,3.0,5.0,Blackberry,Coffee A,Coffee D,Coffee D,I primarily work from home,$20-$40,"I need the ritual, I need the caffeine, It tastes good",True,True,True,False,False,,Yes,No,$4-$6,$6-$8,Yes,$20-$50,Yes,Male,,Bachelor's degree,Hispanic/Latino,,Employed part-time,,Democrat
7d4bx9,18-24 years old,2,At home,True,False,False,False,False,Pour over,True,False,False,False,False,False,False,False,False,False,,,,,,,,,,Cappuccino,,No - just black,True,False,False,False,False,,,,,,,,,,,,,,,,,,,,,,,,,,,,,Bold,Medium,Medium,Full caffeine,6.0,3.0,4.0,2.0,Grapefruit and Dark Chocolate,4.0,3.0,3.0,Brown Sugar and Chocolate,4.0,2.0,4.0,Apples,2.0,4.0,5.0,Blueberries,Coffee C,Coffee D,Coffee D,I primarily work in person,$20-$40,It tastes good,True,False,False,False,False,,Yes,No,$8-$10,$10-$15,Yes,$300-$500,Yes,Male,,Bachelor's degree,White/Caucasian,,Employed full-time,,No affiliation
24x26V,45-54 years old,2,At home,True,False,False,False,False,Espresso,False,False,True,False,False,False,False,False,False,False,,,,,,,,,,Americano,,No - just black,True,False,False,False,False,,,,,,,,,,,,,,,,,,,,,,,,,,,,,Fruity,Somewhat strong,Light,Full caffeine,7.0,2.0,5.0,4.0,Citrus,3.0,3.0,4.0,"Balance, paper",5.0,2.0,2.0,"Stout, better as it cools",2.0,4.0,5.0,Strawberry ,Coffee B,Coffee D,Coffee D,I primarily work in person,$40-$60,"I need the caffeine, I need the ritual, It tastes good",True,True,True,False,False,,Yes,Yes,$8-$10,$10-$15,Yes,"More than $1,000",Yes,Male,,Master's degree,White/Caucasian,,Employed full-time,,Independent
pLP2rP,>65 years old,2,At home,True,False,False,False,False,French press,False,True,False,False,False,False,False,False,False,False,,,,,,,,,,Cappuccino,,"Milk, dairy alternative, or coffee creamer, Sugar or sweetener",False,True,True,False,False,,Half and half,False,False,True,False,False,False,False,False,False,Raw Sugar (Turbinado),False,False,False,False,False,False,False,True,,,,,,,,,Chocolatey,Medium,Dark,Full caffeine,6.0,3.0,5.0,1.0,"Sour, sweet potato",3.0,3.0,3.0,Nutty,4.0,3.0,3.0,,2.0,5.0,2.0,,Coffee C,Coffee D,Coffee C,,$20-$40,"I need the ritual, It tastes good",True,False,True,False,False,,Yes,Yes,$6-$8,$8-$10,Yes,$300-$500,Yes,Female,,Master's degree,White/Caucasian,,Retired,,Democrat
ZdPO2B,35-44 years old,2,"At home, At the office, At a cafe",True,True,False,True,False,"French press, Other",False,True,False,False,False,False,False,False,False,True,Moka pot,,,,,,,,,Latte,,No - just black,True,False,False,False,False,,,,,,,,,,,,,,,,,,,,,,,,,,,,,Full Bodied,Very strong,Medium,Full caffeine,6.0,3.0,4.0,3.0,Caramel; lighter than some of the others,4.0,3.0,5.0,,4.0,2.0,3.0,,2.0,5.0,2.0,,Coffee B,Coffee D,Coffee B,I primarily work in person,$20-$40,"It tastes good, I need the caffeine",True,True,False,False,False,,Yes,Yes,$8-$10,$8-$10,Yes,$300-$500,Yes,Non-binary,,,,,,,
qbE877,35-44 years old,3,At home,True,False,False,False,False,"Pour over, French press, Espresso, Other",True,True,True,False,False,False,False,False,False,True,aero press,,,,,,,,,Pourover,,No - just black,True,False,False,False,False,,,,,,,,,,,,,,,,,,,,,,,,,,,,,Fruity,Medium,Light,Full caffeine,2.0,1.0,4.0,4.0,"fruity, Banana? maybe sweet and sour",3.0,2.0,3.0,"chocolate, darker",2.0,1.0,3.0,couldent really taste bitter or acid in this,3.0,5.0,1.0,"spicy, tobasco ",Coffee B,Coffee A,Coffee B,I primarily work in person,$40-$60,"I need the ritual, It tastes good",True,False,True,False,False,,Yes,Yes,$10-$15,$8-$10,No,$300-$500,Yes,Male,,Some college or associate's degree,Hispanic/Latino,,Employed full-time,2,Democrat
EPBO42,25-34 years old,2,"At the office, At home",True,True,False,False,False,"Coffee extract (e.g. Cometeer), Coffee brewing machine (e.g. Mr. Coffee)",False,False,False,True,False,False,False,False,True,False,,,,,,,,,,Iced coffee,,"Milk, dairy alternative, or coffee creamer",False,True,False,False,False,,"Half and half, Whole milk, Skim milk, Oat milk",True,True,True,False,False,True,False,False,False,,,,,,,,,,,,,,,,,,Full Bodied,Somewhat strong,Medium,Full caffeine,3.0,2.0,4.0,1.0,Sweet and acidic,3.0,1.0,4.0,,4.0,1.0,4.0,Classic dark roast flavors here,1.0,4.0,2.0,Blueberry blackberry ,Coffee C,Coffee D,Coffee C,I do a mix of both,$40-$60,"I need the caffeine, I need the ritual, It tastes good, It makes me go to the bathroom",True,True,True,True,False,,Yes,Yes,$6-$8,$6-$8,No,$100-$300,Yes,Male,,Master's degree,White/Caucasian,,Employed full-time,,Democrat
bl4J97,25-34 years old,2,At home,True,False,False,False,False,Espresso,False,False,True,False,False,False,False,False,False,False,,,,,,,,,,Latte,,"Milk, dairy alternative, or coffee creamer",False,True,False,False,False,,Whole milk,True,False,False,False,False,False,False,False,False,,,,,,,,,,,,,,,,,,Bright,Somewhat strong,Medium,Full caffeine,6.0,2.0,5.0,5.0,,4.0,2.0,2.0,,3.0,3.0,3.0,,1.0,2.0,1.0,,Coffee A,Coffee A,Coffee A,I primarily work from home,$40-$60,"It tastes good, I need the ritual, I need the caffeine",True,True,True,False,False,,Yes,No,$6-$8,$6-$8,Yes,$500-$1000,Yes,Male,,Bachelor's degree,Asian/Pacific Islander,,Employed full-time,,Democrat
YZzl6d,35-44 years old,3,"At the office, At home, On the go, At a cafe",True,True,True,True,False,"Coffee brewing machine (e.g. Mr. Coffee), Espresso, Cold brew",False,False,True,True,False,False,False,True,False,False,,"Local cafe, Specialty coffee shop",False,True,False,True,False,False,,Regular drip coffee,,No - just black,True,False,False,False,False,,,,,,,,,,,,,,,,,,,,,,,,,,,,,Nutty,Somewhat strong,Light,Full caffeine,7.0,2.0,3.0,5.0,,3.0,2.0,4.0,,3.0,3.0,4.0,,2.0,3.0,4.0,,Coffee A,Coffee A,Coffee A,I primarily work from home,$60-$80,"It tastes good, I need the caffeine, I need the ritual",True,True,True,False,False,,Yes,Yes,$6-$8,$8-$10,Yes,"More than $1,000",Yes,Male,,Bachelor's degree,White/Caucasian,,Employed full-time,,Democrat
0EjWPy,25-34 years old,1,At home,True,False,False,False,False,"French press, Coffee brewing machine (e.g. Mr. Coffee)",False,True,False,True,False,False,False,False,False,False,,,,,,,,,,Americano,,No - just black,True,False,False,False,False,,,,,,,,,,,,,,,,,,,,,,,,,,,,,Chocolatey,Somewhat strong,Medium,Decaf,6.0,3.0,5.0,3.0,"changed the most as it cooled, becoming more clearly fruity and acidic over time. tasting notes: lemon water, orange pith. had a smooth mouthfeel.",3.0,2.0,4.0,"balanced. blackberry, bread, apple juice. light mouthfeel.",4.0,1.0,5.0,"nutty, specifically walnut. rich, with a full body.",2.0,4.0,3.0,"blueberry pancakes, burnt sugar with an arresting, juicy tartness. medium body.",Coffee C,Coffee D,Coffee C,I primarily work from home,$20-$40,"It tastes good, I need the ritual",True,False,True,False,False,,Yes,Yes,$10-$15,$15-$20,No,$100-$300,Yes,Male,,Bachelor's degree,White/Caucasian,,Unemployed,,Democrat
kYRBXR,25-34 years old,2,At home,True,False,False,False,False,Pour over,True,False,False,False,False,False,False,False,False,False,,,,,,,,,,Pourover,,No - just black,True,False,False,False,False,,,,,,,,,,,,,,,,,,,,,,,,,,,,,Chocolatey,Medium,Light,Full caffeine,5.0,2.0,4.0,1.0,"Grapefruit, graham cracker",3.0,3.0,1.0,"Dry, velvety, balanced/clear, roasty smoke ",2.0,3.0,2.0,Dry leather,3.0,4.0,2.0,"Raspberries, sugar cookies",Coffee C,Coffee D,Coffee D,I primarily work from home,$20-$40,"I need the ritual, It tastes good",True,False,True,False,False,,Yes,Yes,$6-$8,$6-$8,Yes,$300-$500,Yes,Male,,Some college or associate's degree,White/Caucasian,,Homemaker,,No affiliation
5dqADQ,25-34 years old,2,At home,True,False,False,False,False,"Pour over, Coffee brewing machine (e.g. Mr. Coffee)",True,False,False,True,False,False,False,False,False,False,,,,,,,,,,Pourover,,No - just black,True,False,False,False,False,,,,,,,,,,,,,,,,,,,,,,,,,,,,,Fruity,Very strong,Light,Full caffeine,7.0,2.0,3.0,5.0,"Caramel, toasted marshmallow",3.0,2.0,4.0,"Dark roast, nutty",4.0,2.0,2.0,"Bitter, apple, shoe polish",2.0,4.0,4.0,"Fruity, raisin",Coffee A,Coffee A,Coffee A,I primarily work from home,$80-$100,"It tastes good, I need the caffeine, I need the ritual",True,True,True,False,False,,Yes,Yes,$10-$15,$8-$10,No,$300-$500,Yes,Male,,Bachelor's degree,White/Caucasian,,Employed full-time,,Independent
EPbpKr,25-34 years old,2,At the office,False,True,False,False,False,,,,,,,,,,,,,,,,,,,,,Americano,,No - just black,True,False,False,False,False,,,,,,,,,,,,,,,,,,,,,,,,,,,,,Fruity,Very strong,Light,Full caffeine,7.0,2.0,4.0,4.0,Light and calm,3.0,3.0,3.0,Nutty,4.0,2.0,2.0,Nutty as well more bitter,2.0,4.0,5.0,Sweet,Coffee A,Coffee D,Coffee D,I do a mix of both,$40-$60,"It tastes good, I need the caffeine, I need the ritual",True,True,True,False,False,,Yes,Yes,$10-$15,$15-$20,Yes,$20-$50,Yes,Male,,High school graduate,White/Caucasian,,Employed full-time,,Independent
lNlkBN,25-34 years old,2,At home,True,False,False,False,False,Pour over,True,False,False,False,False,False,False,False,False,False,,,,,,,,,,Pourover,,No - just black,True,False,False,False,False,,,,,,,,,,,,,,,,,,,,,,,,,,,,,Full Bodied,Somewhat strong,Medium,Half caff,3.0,3.0,4.0,1.0,,4.0,2.0,3.0,,2.0,4.0,2.0,,3.0,3.0,3.0,,Coffee B,Coffee D,Coffee D,I primarily work from home,$20-$40,It tastes good,True,False,False,False,False,,Yes,No,$4-$6,$2-$4,No,$20-$50,No,Female,,Master's degree,White/Caucasian,,Employed full-time,2,Republican
VZ1OEj,35-44 years old,2,"At a cafe, At home, On the go",True,False,True,True,False,"Pour over, French press, Espresso, Coffee brewing machine (e.g. Mr. Coffee)",True,True,True,True,False,False,False,False,False,False,,"Local cafe, Specialty coffee shop, National chain (e.g. Starbucks, Dunkin), Drive-thru",True,True,True,True,False,False,,Americano,,No - just black,True,False,False,False,False,,,,,,,,,,,,,,,,,,,,,,,,,,,,,Juicy,Somewhat strong,Medium,Full caffeine,8.0,1.0,5.0,4.0,"apricot, stone fruit, raspberry, blackberry, caramel, butterscotch, light body, acidity increased on cooldown",3.0,2.0,2.0,Bitterness decreased on cooldown,2.0,3.0,2.0,Acidity increased on cooldown,1.0,5.0,5.0,"Juicy, super fruity, strawberry, blueberry, apple, light/medium body, very nice acidity and fruit forward from start to finish",Coffee A,Coffee D,Coffee D,I primarily work from home,$80-$100,"It tastes good, I need the caffeine",True,True,False,False,False,,Yes,Yes,$8-$10,$8-$10,No,"More than $1,000",Yes,Male,,Bachelor's degree,White/Caucasian,,Retired,,No affiliation
DV0q8R,25-34 years old,1,"At home, On the go",True,False,True,False,False,Coffee brewing machine (e.g. Mr. Coffee),False,False,False,True,False,False,False,False,False,False,,"National chain (e.g. Starbucks, Dunkin), Other",True,False,False,False,False,True,Online ordering,Regular drip coffee,,"Milk, dairy alternative, or coffee creamer, Sugar or sweetener",False,True,True,False,False,,"Whole milk, Half and half",True,False,True,False,False,False,False,False,False,"Raw Sugar (Turbinado), Honey",False,False,True,False,False,False,False,True,,,,,,,,,Bright,Somewhat strong,Medium,Full caffeine,3.0,4.0,2.0,3.0,"Felt a bit bitter but not what overwhelming, was more notable as it cooled down, but started to like it a bit less the more I tried it",3.0,2.0,4.0," Was my favorite for most of the test and went down the smoothest, a bit more kick than I was expecting as it cooled",3.0,3.0,4.0,"I started off disliking this almost as much as D, but it started to feel more preferred as I compared it in different orders and had the best aftertaste",1.0,5.0,1.0,"I'm not drinking this again, way way too flavorful in a way I did not enjoy, reminded me of some fruit based drinks or wine in a bad way, my reaction grew to where I stopped taste testing it near the end",Coffee B,Coffee A,Coffee C,I primarily work from home,<$20,"I need the caffeine, It tastes good, I need the ritual",True,True,True,False,False,,Yes,No,$2-$4,$4-$6,No,$50-$100,Yes,Non-binary,,Some college or associate's degree,White/Caucasian,,Employed full-time,,Independent
GrozzO,18-24 years old,1,At home,True,False,False,False,False,Other,False,False,False,False,False,False,False,False,False,True,Aeropress,,,,,,,,,Blended drink (e.g. Frappuccino),,"Milk, dairy alternative, or coffee creamer, Sugar or sweetener",False,True,True,False,False,,Whole milk,True,False,False,False,False,False,False,False,False,Stevia,False,False,False,False,True,False,False,False,,,,,,,,,Full Bodied,Somewhat strong,Medium,Decaf,4.0,1.0,3.0,1.0,Baked Beans,2.0,1.0,4.0,Cacao,4.0,1.0,3.0,Almond,1.0,4.0,1.0,Elderberry,Coffee B,Coffee D,Coffee B,I do a mix of both,<$20,It tastes good,True,False,False,False,False,,Yes,No,$4-$6,$4-$6,Yes,$50-$100,Yes,Male,,Bachelor's degree,White/Caucasian,,Employed full-time,,Republican
VZ16Wy,25-34 years old,Less than 1,"At home, On the go, At a cafe",True,False,True,True,False,Espresso,False,False,True,False,False,False,False,False,False,False,,"National chain (e.g. Starbucks, Dunkin), Local cafe, Specialty coffee shop, Drive-thru",True,True,True,True,False,False,,Latte,,"Milk, dairy alternative, or coffee creamer, Flavor syrup",False,True,False,True,False,,Oat milk,False,False,False,False,False,True,False,False,False,,,,,,,,,,,,,,,,,,Caramalized,Somewhat light,Medium,Decaf,3.0,2.0,4.0,4.0,,4.0,1.0,2.0,,2.0,3.0,5.0,,3.0,2.0,3.0,,Coffee C,Coffee D,Coffee C,I primarily work from home,$20-$40,It tastes good,True,False,False,False,False,,Yes,No,$8-$10,$8-$10,No,$100-$300,Yes,Female,,Bachelor's degree,White/Caucasian,,Homemaker,2,Democrat
24xGy9,35-44 years old,1,"At home, On the go",True,False,True,False,False,Espresso,False,False,True,False,False,False,False,False,False,False,,Specialty coffee shop,False,False,False,True,False,False,,Latte,,"Milk, dairy alternative, or coffee creamer, Sugar or sweetener, Other",False,True,True,False,True,Salt,Whole milk,True,False,False,False,False,False,False,False,False,Maple Syrup,False,False,False,True,False,False,False,False,,,,,,,,,Chocolatey,Somewhat strong,Medium,Full caffeine,5.0,2.0,1.0,5.0,"Chocolate, caramel",2.0,1.0,2.0,"Smoky, tobacco",3.0,1.0,1.0,Tobacco,1.0,4.0,3.0,Fruit and cherry,Coffee A,Coffee A,Coffee A,I primarily work from home,$40-$60,It tastes good,True,False,False,False,False,,Yes,Yes,$6-$8,$6-$8,Yes,$500-$1000,Yes,Female,,Bachelor's degree,White/Caucasian,,Employed part-time,2,Independent
bl2BVe,25-34 years old,2,At the office,False,True,False,False,False,,,,,,,,,,,,,,,,,,,,,Regular drip coffee,,"Milk, dairy alternative, or coffee creamer",False,True,False,False,False,,Half and half,False,False,True,False,False,False,False,False,False,,,,,,,,,,,,,,,,,,Full Bodied,Medium,Light,Full caffeine,2.0,4.0,4.0,1.0,,2.0,2.0,5.0,,3.0,4.0,2.0,,3.0,3.0,3.0,,Coffee B,Coffee D,Coffee B,I primarily work in person,$20-$40,"I need the ritual, It tastes good, I need the caffeine",True,True,True,False,False,,Yes,No,$6-$8,$8-$10,Yes,$50-$100,Yes,Male,,Bachelor's degree,White/Caucasian,,Employed full-time,,Republican
kYRBDj,45-54 years old,2,At home,True,False,False,False,False,Espresso,False,False,True,False,False,False,False,False,False,False,,,,,,,,,,Espresso,,No - just black,True,False,False,False,False,,,,,,,,,,,,,,,,,,,,,,,,,,,,,Floral,Very strong,Medium,Full caffeine,3.0,1.0,4.0,3.0,Dogwood ,1.0,2.0,4.0,Flowers ,1.0,3.0,3.0,,1.0,5.0,1.0,,Coffee B,Coffee A,Coffee B,I primarily work in person,$40-$60,"It tastes good, I need the ritual, It makes me go to the bathroom",True,False,True,True,False,,Yes,No,$8-$10,$8-$10,Yes,$50-$100,Yes,Female,,Master's degree,White/Caucasian,,Employed part-time,1,No affiliation
VZ16Zy,25-34 years old,1,At home,True,False,False,False,False,"Pour over, Espresso",True,False,True,False,False,False,False,False,False,False,,,,,,,,,,Pourover,,No - just black,True,False,False,False,False,,,,,,,,,,,,,,,,,,,,,,,,,,,,,Bright,Medium,Light,Full caffeine,7.0,1.0,5.0,5.0,"Lime, warhead candy, caramel, light body",3.0,2.0,3.0,"Heavier body than A, chocolate, graham cracker",4.0,1.0,2.0,"Medium to heavy body, tobacco",1.0,4.0,5.0,"Light body, strawberry",Coffee A,Coffee A,Coffee A,I primarily work from home,$60-$80,"It tastes good, I need the caffeine, I need the ritual",True,True,True,False,False,,Yes,Yes,More than $20,More than $20,No,"More than $1,000",Yes,Male,,Bachelor's degree,Asian/Pacific Islander,,Employed full-time,,Democrat
