RzByqd,25-34 years old,2,At home,True,False,False,False,False,"Pour over, French press, Other",True,True,False,False,False,False,False,False,False,True,aeropress,,,,,,,,,Regular drip coffee,,No - just black,True,False,False,False,False,,,,,,,,,,,,,,,,,,,,,,,,,,,,,Fruity,Somewhat strong,Light,Full caffeine,7.0,2.0,4.0,4.0,,4.0,2.0,2.0,,5.0,1.0,3.0,,1.0,3.0,5.0,,Coffee A,Coffee D,Coffee D,I primarily work from home,$20-$40,"It tastes good, I need the caffeine, I need the ritual",True,True,True,False,False,,Yes,Yes,$6-$8,More than $20,No,"More than $1,000",Yes,Male,,Bachelor's degree,White/Caucasian,,Employed full-time,,No affiliation
VZ9WWj,25-34 years old,2,"At home, At the office, On the go",True,True,True,False,False,"Pour over, Cold brew",True,False,False,False,False,False,False,True,False,False,,"National chain (e.g. Starbucks, Dunkin), Specialty coffee shop, Local cafe",True,True,False,True,False,False,,Pourover,,"Milk, dairy alternative, or coffee creamer, Sugar or sweetener, No - just black",True,True,True,False,False,,Half and half,False,False,True,False,False,False,False,False,False,"Granulated Sugar, Raw Sugar (Turbinado)",True,False,False,False,False,False,False,True,,,,,,,,,Full Bodied,Somewhat strong,Medium,Full caffeine,7.0,1.0,3.0,4.0,mellow and easy to drink,2.0,1.0,2.0,"couldnt taste a lot of flavor, bland",3.0,1.0,5.0,good overall flavor,2.0,4.0,3.0,a lot of flavors. a good coffee for food pairings,Coffee C,Coffee A,Coffee C,I primarily work in person,<$20,"It tastes good, I need the caffeine, I need the ritual, It makes me go to the bathroom",True,True,True,True,False,,Yes,Yes,$8-$10,$10-$15,No,$100-$300,Yes,Male,,Some college or associate's degree,White/Caucasian,,Employed full-time,,No affiliation
bl2klo,35-44 years old,2,At home,True,False,False,False,False,Espresso,False,False,True,False,False,False,False,False,False,False,,,,,,,,,,Espresso,,No - just black,True,False,False,False,False,,,,,,,,,,,,,,,,,,,,,,,,,,,,,Floral,Very strong,Light,Full caffeine,7.0,3.0,4.0,4.0,,5.0,1.0,1.0,,3.0,2.0,2.0,,3.0,4.0,5.0,"Most unique flavor, by far. Loved the complexity. Very smooth, thick texture. Very pleasant.",Coffee A,Coffee D,Coffee D,I primarily work in person,$80-$100,"It tastes good, I need the caffeine, I need the ritual, It makes me go to the bathroom",True,True,True,True,False,,Yes,Yes,$8-$10,$8-$10,Yes,"More than $1,000",Yes,Male,,Doctorate or professional degree,White/Caucasian,,Employed full-time,,Democrat
ylelyX,18-24 years old,1,"On the go, At home, At a cafe",True,False,True,True,False,Espresso,False,False,True,False,False,False,False,False,False,False,,Local cafe,False,True,False,False,False,False,,Latte,,"Milk, dairy alternative, or coffee creamer",False,True,False,False,False,,Whole milk,True,False,False,False,False,False,False,False,False,,,,,,,,,,,,,,,,,,Sweet,Medium,Medium,Full caffeine,4.0,2.0,5.0,4.0,"Whole milke texture almost, mellow after feel, good body",2.0,5.0,3.0,"Skim texture, Darker, Medium",2.0,2.0,4.0,"Skim texture, Darker, chocolate notes",1.0,3.0,5.0,"Almost like a whole milk texture, lighter, very high clarity, caramel notes",Coffee C,Coffee D,Coffee D,I primarily work in person,$60-$80,"I need the caffeine, It tastes good, I need the ritual",True,True,True,False,False,,Yes,Yes,$8-$10,$10-$15,No,"More than $1,000",Yes,Male,,Some college or associate's degree,White/Caucasian,,Employed full-time,,Independent
vNx5gl,25-34 years old,1,"At home, At a cafe",True,False,False,True,False,Pour over,True,False,False,False,False,False,False,False,False,False,,,,,,,,,,Latte,,No - just black,True,False,False,False,False,,,,,,,,,,,,,,,,,,,,,,,,,,,,,Fruity,Somewhat strong,Light,Full caffeine,6.0,3.0,3.0,2.0,Earthy,3.0,1.0,3.0,,3.0,4.0,3.0,,2.0,4.0,5.0,"Fruity, similar to high acid chocolate",Coffee C,Coffee D,Coffee A,I primarily work from home,$40-$60,It tastes good,True,False,False,False,False,,Yes,Yes,$8-$10,$8-$10,Yes,$100-$300,Yes,Male,,Bachelor's degree,White/Caucasian,,Unemployed,,Democrat
9d6NaY,55-64 years old,3,"At home, At the office, At a cafe",True,True,False,True,False,"Pour over, Espresso, Cold brew, Coffee brewing machine (e.g. Mr. Coffee)",True,False,True,True,False,False,False,True,False,False,,,,,,,,,,Cortado,,No - just black,True,False,False,False,False,,,,,,,,,,,,,,,,,,,,,,,,,,,,,Bold,Very strong,Medium,Full caffeine,8.0,2.0,4.0,2.0,"Toasty at first, after cooled mapley ",3.0,3.0,1.0,"Flat tasting, finished muddy as it cooled did not like",3.0,4.0,4.0,Very tasty,2.0,4.0,5.0,Tasted like berries ,Coffee C,Coffee D,Coffee D,I primarily work in person,$20-$40,It tastes good,True,False,False,False,False,,Yes,Yes,$6-$8,$6-$8,No,$100-$300,Yes,Female,,Some college or associate's degree,White/Caucasian,,Employed full-time,,
KMPpk8,18-24 years old,Less than 1,At a cafe,False,False,False,True,False,,,,,,,,,,,,,,,,,,,,,Cortado,,Other,False,False,False,False,True,Don't drink coffee only espresso,,,,,,,,,,,,,,,,,,,,,,,,,,,,Chocolatey,Somewhat strong,Dark,Full caffeine,2.0,2.0,2.0,1.0,,4.0,2.0,3.0,,3.0,2.0,2.0,,2.0,4.0,2.0,,Coffee B,Coffee A,Coffee B,I do a mix of both,<$20,Other,False,False,False,False,True,Vibes,No,No,$2-$4,$4-$6,No,Less than $20,Yes,Male,,Bachelor's degree,Hispanic/Latino,,Employed full-time,,Democrat
rlrxo5,25-34 years old,2,At a cafe,False,False,False,True,False,,,,,,,,,,,,,,,,,,,,,Pourover,,No - just black,True,False,False,False,False,,,,,,,,,,,,,,,,,,,,,,,,,,,,,Full Bodied,Medium,Medium,Full caffeine,6.0,2.0,4.0,3.0,"Nice African coffee, tangy and acidic with a nice finish. Lemon and tangerine tasting notes",3.0,3.0,2.0,"Mild but would be nice to have stronger. Graham cracker, honey, chocolate",2.0,2.0,3.0,Very smooth at first with a heavy caramel finish. Butterscotch and nutty flavors as well.,3.0,1.0,5.0,Very nice coffee for any time of day. Dark currant and berry with milk chocolate.,Coffee A,Coffee D,Coffee D,I primarily work in person,$20-$40,It tastes good,True,False,False,False,False,,Yes,Yes,$6-$8,$10-$15,Yes,$50-$100,Yes,Male,,High school graduate,White/Caucasian,,Employed full-time,,No affiliation
24O8PA,18-24 years old,3,At home,True,False,False,False,False,"Pour over, Other",True,False,False,False,False,False,False,False,False,True,Aeropress,,,,,,,,,Pourover,,No - just black,True,False,False,False,False,,,,,,,,,,,,,,,,,,,,,,,,,,,,,Fruity,Very strong,Light,Full caffeine,7.0,1.0,5.0,4.0,"Lemon, freeze dried raspberry, a hint of dark chocolate with cranberry chunks. Fresh squeezed lemon juice with a touch of pith, but overall pleasant. This is juicy and clean, right up my wheelhouse. ",3.0,1.0,2.0,"Thin, dry paper, unremarkable and not all that pleasant, but not unpleasant. If I had to guess, this is barely specialty, 80 scoring Brazilian that’s medium roasted. Similar to the low end from the Ghost Cupping Club. The more it cools the worst it tastes, but not commodity dark roast bad. ",3.0,1.0,1.0,"1, easily a 1. On re-taste. There’s a drying paper quality as it cools that comes in the finish with an unpleasant bitterness. Not commodity dark roast, still specialty but not great. 
",2.0,3.0,3.0,"A bit confusing, but there’s some stewed fruits and baking spices. ",Coffee A,Coffee A,Coffee A,I primarily work in person,$40-$60,"It tastes good, I need the caffeine",True,True,False,False,False,,Yes,Yes,$15-$20,More than $20,Yes,$500-$1000,Yes,Male,,Bachelor's degree,White/Caucasian,,Employed full-time,,Democrat
